{
  "type": "vampirism:infuser",
  "commoninfo": {},
  "ingredient1": "vampirism:pure_blood_4",
  "ingredient2": "vampirism:pure_blood_4",
  "ingredient3": "vampirism:pure_blood_4",
  "ingredient4": "vampirism:pure_blood_4",
  "item": {
    "neoforge:ingredient_type": "neoforge:compound",
    "children": [
      {
        "neoforge:ingredient_type": "neoforge:components",
        "components": {
          "vampirism:pure_level": {
            "level": 0
          }
        },
        "items": "vampirism:iron_heart_striker"
      },
      {
        "neoforge:ingredient_type": "neoforge:components",
        "components": {
          "vampirism:pure_level": {
            "level": 1
          }
        },
        "items": "vampirism:iron_heart_striker"
      },
      {
        "neoforge:ingredient_type": "neoforge:components",
        "components": {
          "vampirism:pure_level": {
            "level": 2
          }
        },
        "items": "vampirism:iron_heart_striker"
      },
      {
        "neoforge:ingredient_type": "neoforge:components",
        "components": {
          "vampirism:pure_level": {
            "level": 3
          }
        },
        "items": "vampirism:iron_heart_striker"
      }
    ]
  }
}