{
  "type": "vampirism:infuser",
  "commoninfo": {},
  "ingredient1": "vampirism:pure_blood_0",
  "ingredient2": "vampirism:pure_blood_0",
  "ingredient3": "vampirism:pure_blood_0",
  "ingredient4": "vampirism:pure_blood_0",
  "item": "minecraft:raw_iron",
  "result": {
    "components": {
      "vampirism:pure_level": {
        "level": 0
      }
    },
    "id": "vampirism:blood_infused_raw_iron"
  },
  "result1": {
    "id": "vampirism:vampire_blood_bottle"
  },
  "result2": {
    "id": "vampirism:vampire_blood_bottle"
  },
  "result3": {
    "id": "vampirism:vampire_blood_bottle"
  }
}